{"members":[{"digest":"sha256:754b28ff6f9b7e0ef098a6635f41597ef7d637d0348d03f8f27ae28c14b8fc37","path":".kos/workflows/quick-fix/1.0.0/materials/development-guidance.md"},{"digest":"sha256:b65b0228f00887ec23438098c07e3e5e43326c74b1cb538b761ff16a6e1ab393","path":".kos/workflows/quick-fix/1.0.0/materials/planning-guidance.md"},{"digest":"sha256:4bc665df9bb93ba9e31e0082e1673828cba32c270ebfc5fc078366c1b954c11d","path":".kos/workflows/quick-fix/1.0.0/steps/development.md"},{"digest":"sha256:66fd8f1fd18323c8270d4cdf51bfd45d30bc41e390746d2060fd3168b20960f0","path":".kos/workflows/quick-fix/1.0.0/steps/implementation-planning.md"},{"digest":"sha256:8565c774e1b6558ad7189fe647de40d5ab88ece54ac4fcf2256d7f4660eeff18","path":".kos/workflows/quick-fix/1.0.0/steps/publication.md"},{"digest":"sha256:57789d130c7696fe598612053d75191febb4daffcc3f5863d2f476025e5482cf","path":".kos/workflows/quick-fix/1.0.0/steps/review.md"},{"digest":"sha256:d73acdce0ea4980ddad27ce13e4b4a169a28bff5f347c431dbf3a02a7387f745","path":".kos/workflows/quick-fix/1.0.0/workflow.yaml"}],"schema_version":"1","workflow_id":"quick-fix","workflow_version":"1.0.0"}